stage_index,name,chinese,english,context,tint_r,tint_g,tint_b
0,初心,"画家转码农
发现编程也是艺术",Hackers are makers. They're not scientists.,康奈尔→哈佛CS博士→画家→Viaweb→Yahoo收购。画画和写代码是同一种冲动,150,170,190
1,写作,"随笔不是表达已有的想法
而是发现真正的想法","Essays are not a way to convey ideas, but to generate them.",2001 · 开始写essays。写作不是输出是思考。一篇好essay来自一个你还没想通的问题,140,165,185
2,创业,"做不可规模化的事
是早期创业核心",The most common unscalable thing founders have to do is recruit users manually.,YC诞生 — 一个一个手动拉用户不是笨办法，是不可或缺的学习阶段,135,160,180
3,品味,"好品味不是天赋
是见过足够多好作品后的判断力",Good taste can be cultivated and must be cultivated.,审美疲劳是最好的老师。见过足够多好东西之后，差的东西会让你本能不适,145,170,188
4,坚持,"固执的正确
看起来像是错误的错误",The most successful founders are often the ones who seem most wrong at the time.,市场不认可≠你错了。YC投资Airbnb时所有人都觉得疯了。反直觉是创新的入场券,130,155,175
5,创始人,"做人们想要的东西
其他一切都会跟上",Make something people want.,YC的核心哲学浓缩为一句话。不是「做出完美产品」，是「做出人们抢着用的东西」,140,162,182
6,黑客,"黑客与画家
本质上是同一类人",What hackers and painters have in common is that they're both makers.,编程不是科学是工艺。正如画家画布上的笔触，代码也是逐渐变好的草图,125,150,170
7,传承,"找你自己真正遇到的问题
而不是努力想创业点子","The way to get startup ideas is to look for problems, not startup ideas.",1964– · YC从8家公司到3000+。给下一代创始人的礼物是勇气，不是蓝图,140,165,185
